Announcement ID,Time,System Time,Keywords,Title,Summary,Link
3,"Fri, 31 May 2024 13:19:00 +0000",2024-06-03 01:55:18.764810,partnership,"Huatu Education and National University of Malaysia Announce Partnership to Create ASEAN College, Ushering in a New Era of International Talent Development","<p>BEIJING, May 31, 2024 /PRNewswire/ -- On May 30, Huatu Education Group (Huatu) and the National University of Malaysia (UKM) formally signed an agreement to establish the ASEAN College at UKM. The signing ceremony took place at Huatu's headquarters with the attendance of Datuk Ahmad...</p>",https://www.prnewswire.com/apac/news-releases/huatu-education-and-national-university-of-malaysia-announce-partnership-to-create-asean-college-ushering-in-a-new-era-of-international-talent-development-302160677.html
7,"Wed, 29 May 2024 19:00:02 +0000",2024-06-03 01:57:46.204452,partnership,Ellevest and HelloPrenup Forge Strategic Partnership to Demystify Prenuptial Agreements,,https://www.newswire.com/news/ellevest-and-helloprenup-forge-strategic-partnership-to-demystify-22340459
8,"Wed, 29 May 2024 11:00:08 +0000",2024-06-03 01:57:46.204452,partnership,Living Security and Vaillance Group Expand Partnership to Identify Cybersecurity Risks and Mitigate Insider Threats,"Combining Vaillance's human risk vulnerability assessments and program development with the Living Security Unify Human Risk Management (HRM) Platform provides organizations with the resources to protect assets, people, and confidential data.",https://www.newswire.com/news/living-security-and-vaillance-group-expand-partnership-to-identify-22346284
9,"Wed, 22 May 2024 13:15:02 +0000",2024-06-03 01:57:46.204452,partnership,Proactive Worldwide Announces Strategic Partnership With Academy of Competitive Intelligence LLC (ACI),"Proactive Worldwide's CI Blueprint® Course Joins ACI's CIP-I™ Certification Program, Enhancing Competitive Intelligence Training for Professionals at All Levels",https://www.newswire.com/news/proactive-worldwide-announces-strategic-partnership-with-academy-of-22337883
12,"Fri, 17 May 2024 16:00:05 +0000",2024-06-03 01:57:46.204452,partnership,MPH.com Elevates Online Car Shopping Experience With CARFAX Partnership,,https://www.newswire.com/news/mph-com-elevates-online-car-shopping-experience-with-carfax-partnership-22328833
13,"Fri, 17 May 2024 15:22:28 +0000",2024-06-03 01:57:46.204452,partnership,Tidal Wave Auto Spa Announces Official Partnership With the Atlanta Braves,"Tidal Wave’s First Partnership with a Major League Sports Team to Include On-site Activations, Exclusive Giveaways, Community Events, and More",https://www.newswire.com/news/tidal-wave-auto-spa-announces-official-partnership-with-the-atlanta-22334147
21,"Wed, 09 Aug 2023 14:15:07 +0000",2024-06-03 01:57:49.400946,partnership,First Bank and ampliFI Loyalty Solutions Join Together to Launch Loyalty Partnership,,https://www.newswire.com/news/first-bank-and-amplifi-loyalty-solutions-join-together-to-launch-22096045
